{
  "$schema": "../../../../spec/schemas/component-preview.schema.json",
  "schema": "neosmartuxui/component-preview@1",
  "component": "core.description-list",
  "fixture": "fixture.html",
  "controller": null,
  "fixtureComponents": [
    "core.button"
  ],
  "defaultState": "rest",
  "resetStrategy": "remount",
  "stateRealization": {
    "rest": {
      "mode": "fixture",
      "target": "#description-list-demo"
    }
  },
  "renderers": {
    "web": {
      "styles": [
        "packages/adapters/web/components/description-list.css",
        "packages/adapters/web/components/button.css"
      ],
      "bindings": []
    }
  }
}
